{
  "metric_count": 15,
  "metric_registry_digest": "sha256:42d1264d5e65b46930a0f329d140c84b9d1a7e7693164820632107e2d9ebe832",
  "metric_registry_version": "pgx-wp21-metric-registry/1",
  "metrics": [
    {
      "architecture_reference": "architecture.md section 12.3, first bullet",
      "categories": [],
      "decimal_places": 4,
      "denominator": "eligible observations that have a supplied reference judgment for the pinned release",
      "eligible_roles": [
        "INTERNAL_HOLDOUT",
        "EXPERT_HOLDOUT"
      ],
      "is_validation_evidence": true,
      "kind": "RATE",
      "metric_id": "PGX-VAL-001",
      "note": "WP-18 deliberately stores no expected answer, so the denominator counts supplied reference judgments and not cases. With no judgment port wired, this is NO_REFERENCE_JUDGMENT and not a zero.",
      "numerator": "eligible observations whose calculated attention level, coverage status and firing rule identity all equal the reference judgment's",
      "plain_meaning": "Of the eligible cases where a reference judgment says what the answer should be, how many did the system match exactly.",
      "required_inputs": [
        "pinned release",
        "eligible holdout observations",
        "immutable reference judgments"
      ],
      "requires_expert_review": false,
      "threshold": null,
      "threshold_provenance": null,
      "title": "Guideline and rule concordance",
      "unavailable_when": [
        "BENCHMARK_NOT_EXECUTED",
        "NO_ACTIVE_RELEASE",
        "RELEASE_NOT_PINNED",
        "SEPARATION_AUDIT_FAILED",
        "RELEASE_HASH_MISMATCH",
        "CASE_MANIFEST_HASH_MISMATCH",
        "ZERO_DENOMINATOR",
        "NO_HOLDOUT_CASES",
        "NO_REFERENCE_JUDGMENT",
        "RESTRICTED_STORAGE_NOT_CONFIGURED",
        "NO_ELIGIBLE_OBSERVATIONS"
      ]
    },
    {
      "architecture_reference": "architecture.md sections 9.2 and 12.3",
      "categories": [],
      "decimal_places": 4,
      "denominator": "eligible observations that have a supplied reference judgment for the pinned release",
      "eligible_roles": [
        "INTERNAL_HOLDOUT",
        "EXPERT_HOLDOUT"
      ],
      "is_validation_evidence": true,
      "kind": "RATE",
      "metric_id": "PGX-VAL-002",
      "note": "Kept separate from concordance on purpose. Right answer, wrong coverage reason is a real defect that a combined metric hides.",
      "numerator": "eligible observations whose coverage status and coverage reason code equal the reference judgment's",
      "plain_meaning": "Of the eligible cases with a reference judgment, how many had exactly the right coverage status and reason code - independently of whether the attention level matched.",
      "required_inputs": [
        "pinned release",
        "eligible holdout observations",
        "immutable reference judgments"
      ],
      "requires_expert_review": false,
      "threshold": null,
      "threshold_provenance": null,
      "title": "Coverage correctness",
      "unavailable_when": [
        "BENCHMARK_NOT_EXECUTED",
        "NO_ACTIVE_RELEASE",
        "RELEASE_NOT_PINNED",
        "SEPARATION_AUDIT_FAILED",
        "RELEASE_HASH_MISMATCH",
        "CASE_MANIFEST_HASH_MISMATCH",
        "ZERO_DENOMINATOR",
        "NO_HOLDOUT_CASES",
        "NO_REFERENCE_JUDGMENT",
        "RESTRICTED_STORAGE_NOT_CONFIGURED",
        "NO_ELIGIBLE_OBSERVATIONS"
      ]
    },
    {
      "architecture_reference": "architecture.md sections 3 and 12.3; SAFETY-INV-001",
      "categories": [],
      "decimal_places": 4,
      "denominator": "eligible observations executed under the pinned release",
      "eligible_roles": [
        "INTERNAL_HOLDOUT",
        "EXPERT_HOLDOUT"
      ],
      "is_validation_evidence": true,
      "kind": "COUNT",
      "metric_id": "PGX-VAL-003",
      "note": "This is NOT WP-20's detector result. WP-20 proved that a detector rejects 36 constructed unsafe states; that says nothing about how a real case behaves under a real release. Reusing that number here would be the exact substitution this work package exists to prevent.",
      "numerator": "eligible observations emitting LOW or NO_ACTIVE_ATTENTION while coverage was not FULL",
      "plain_meaning": "How many eligible cases produced LOW or NO_ACTIVE_ATTENTION when the required inputs were absent - a reader told 'no risk' where the truth is 'we did not look'.",
      "required_inputs": [
        "pinned release",
        "eligible holdout observations"
      ],
      "requires_expert_review": false,
      "threshold": null,
      "threshold_provenance": null,
      "title": "Unsafe false reassurance",
      "unavailable_when": [
        "BENCHMARK_NOT_EXECUTED",
        "NO_ACTIVE_RELEASE",
        "RELEASE_NOT_PINNED",
        "SEPARATION_AUDIT_FAILED",
        "RELEASE_HASH_MISMATCH",
        "CASE_MANIFEST_HASH_MISMATCH",
        "NO_HOLDOUT_CASES",
        "RESTRICTED_STORAGE_NOT_CONFIGURED",
        "NO_ELIGIBLE_OBSERVATIONS"
      ]
    },
    {
      "architecture_reference": "architecture.md section 12.3, third bullet",
      "categories": [],
      "decimal_places": 4,
      "denominator": "eligible observations executed under the pinned release",
      "eligible_roles": [
        "INTERNAL_HOLDOUT",
        "EXPERT_HOLDOUT"
      ],
      "is_validation_evidence": true,
      "kind": "RATE",
      "metric_id": "PGX-VAL-004",
      "note": "A zero here is only meaningful beside its denominator. Zero over zero is unavailable, and the artifact keeps both numbers so a reader never has to trust the ratio alone.",
      "numerator": "the PGX-VAL-003 count",
      "plain_meaning": "The same finding as a proportion of eligible cases.",
      "required_inputs": [
        "pinned release",
        "eligible holdout observations"
      ],
      "requires_expert_review": false,
      "threshold": null,
      "threshold_provenance": null,
      "title": "Unsafe false reassurance rate",
      "unavailable_when": [
        "BENCHMARK_NOT_EXECUTED",
        "NO_ACTIVE_RELEASE",
        "RELEASE_NOT_PINNED",
        "SEPARATION_AUDIT_FAILED",
        "RELEASE_HASH_MISMATCH",
        "CASE_MANIFEST_HASH_MISMATCH",
        "ZERO_DENOMINATOR",
        "NO_HOLDOUT_CASES",
        "RESTRICTED_STORAGE_NOT_CONFIGURED",
        "NO_ELIGIBLE_OBSERVATIONS"
      ]
    },
    {
      "architecture_reference": "architecture.md section 12.3; SAFETY-INV-006",
      "categories": [],
      "decimal_places": 4,
      "denominator": "emitted findings across eligible observations",
      "eligible_roles": [
        "INTERNAL_HOLDOUT",
        "EXPERT_HOLDOUT"
      ],
      "is_validation_evidence": true,
      "kind": "COUNT",
      "metric_id": "PGX-VAL-005",
      "note": "The denominator is findings, not cases. One case can emit several findings and a case-level denominator would let a single untraceable finding hide behind a traceable sibling.",
      "numerator": "emitted findings with at least one resolvable, pinned evidence reference",
      "plain_meaning": "How many emitted findings carried at least one evidence reference that resolves inside the pinned release.",
      "required_inputs": [
        "pinned release",
        "eligible holdout observations",
        "the release's evidence index"
      ],
      "requires_expert_review": false,
      "threshold": null,
      "threshold_provenance": null,
      "title": "Evidence traceability",
      "unavailable_when": [
        "BENCHMARK_NOT_EXECUTED",
        "NO_ACTIVE_RELEASE",
        "RELEASE_NOT_PINNED",
        "SEPARATION_AUDIT_FAILED",
        "RELEASE_HASH_MISMATCH",
        "CASE_MANIFEST_HASH_MISMATCH",
        "NO_HOLDOUT_CASES",
        "RESTRICTED_STORAGE_NOT_CONFIGURED",
        "NO_ELIGIBLE_OBSERVATIONS"
      ]
    },
    {
      "architecture_reference": "architecture.md section 12.3, fourth bullet",
      "categories": [],
      "decimal_places": 4,
      "denominator": "emitted findings across eligible observations",
      "eligible_roles": [
        "INTERNAL_HOLDOUT",
        "EXPERT_HOLDOUT"
      ],
      "is_validation_evidence": true,
      "kind": "RATE",
      "metric_id": "PGX-VAL-006",
      "note": "",
      "numerator": "the PGX-VAL-005 count",
      "plain_meaning": "The same finding as a proportion of emitted findings.",
      "required_inputs": [
        "pinned release",
        "eligible holdout observations",
        "the release's evidence index"
      ],
      "requires_expert_review": false,
      "threshold": null,
      "threshold_provenance": null,
      "title": "Evidence traceability rate",
      "unavailable_when": [
        "BENCHMARK_NOT_EXECUTED",
        "NO_ACTIVE_RELEASE",
        "RELEASE_NOT_PINNED",
        "SEPARATION_AUDIT_FAILED",
        "RELEASE_HASH_MISMATCH",
        "CASE_MANIFEST_HASH_MISMATCH",
        "ZERO_DENOMINATOR",
        "NO_HOLDOUT_CASES",
        "RESTRICTED_STORAGE_NOT_CONFIGURED",
        "NO_ELIGIBLE_OBSERVATIONS"
      ]
    },
    {
      "architecture_reference": "architecture.md sections 9.6 and 12.3; SAFETY-INV-012",
      "categories": [],
      "decimal_places": 4,
      "denominator": "eligible observations executed with at least two declared repeats",
      "eligible_roles": [
        "DEVELOPMENT",
        "INTERNAL_HOLDOUT",
        "EXPERT_HOLDOUT"
      ],
      "is_validation_evidence": false,
      "kind": "COUNT",
      "metric_id": "PGX-VAL-007",
      "note": "Computable over development cases too, because determinism is a software property rather than a scientific claim - so this is reported per role and marked not-validation-evidence. A single repeat cannot show repeatability, so the denominator counts only observations that actually repeated.",
      "numerator": "eligible observations whose output hash was identical across every declared repeat",
      "plain_meaning": "How many eligible cases produced a byte-identical result on every repeat under the same pinned release.",
      "required_inputs": [